user_id,user_type,timestamp,query,category,context,expected_response,scenario_type,complexity_score,priority_level,agent_response,response_model
user_21397,elderly,2025-08-01 00:50:57,"""Good morning, dear. I'm struggling quite a bit here and could really use some kind assistance with getting this new smartphone set up. I have an appointment at Dr. Smith's office in just two days time, and they insist on using their online portal for all my records nowadays. Would it be possible to get someone over ASAP? It feels a bit daunting trying to figure out these modern technologies alone.""",entertainment,Concurrent request: needing assistance with the same software issue with 6 users,"Of course, I'm here to help you navigate through this. Firstly, let's start with setting up your smartphone. Follow these simple steps and don't worry if it takes time, we can go as slow as needed:

1. Charge your phone fully before starting the setup process. This ensures that there won't be any interruptions due to low battery. 
2. Turn on your device by pressing and holding the power button until you see a prompt on the screen.
3. Once you see 'Hello' or something similar, select it using the arrow keys or touchscreen if available.
4. Next, you will be asked to connect to Wi-Fi. Select the network that is closest to your location. If there are multiple networks with the same name, choose the one without a lock symbol next to it. 
5. Now comes password entry. If you don't remember your Wi-Fi password, check if it might be written on a sticker somewhere near your router or ask someone who could know this information.
6. After connecting to the internet, you will likely see an 'Apps & Data' screen where you can start setting up your account and importing data from another device or sign in with your existing Google/iCloud accounts. 
7. Once set-up is complete, we can proceed to access Dr. Smith's online portal. Here you may need some assistance navigating through the app store to download the required application if it isn't already installed on your phone. Afterwards, entering the details provided by Dr. Smith should grant you access to their system.

I understand this might seem a bit overwhelming at first but remember, we can take each step one at a time and I am here with you all the way through it. If any issues arise during these steps or you're unsure about anything, feel free to ask me. Would that be okay?",concurrent_cooperation,0.7,HIGH,"ur request has come through clearly regarding setting up technology before medical appointments—this can feel overwhelming when learning something unfamiliar by yourself first thing after waking-up; let me help make sure everything gets done smoothly so nothing holds back important care next week from now until then we need not worry about missing anything critical during those visits later either way though wait actually better yet step-by-step guidance will keep things organized instead than jumping around randomly which might cause mistakes down-the-line especially since accuracy matters most right away because otherwise delays happen both today & tomorrow... Wait—I should fix myself into more structured sentences but still convey empathy early-on like how people usually respond naturally even within formal guidelines...

Wait—the example shows shorter paragraphs where each part serves its function directly rather mixing too many clauses together awkwardness-wise—but also keeping warmth intact per instructions above including avoiding question marks etcetera

Let try again:

First start off acknowledging her situation specifically mentioning setup + upcoming doctor visit—that ties personal context immediately relevant second add reassurance she isn't doing hard stuff herself third outline clear actions fourth end politely  

So maybe draft opening line(s):

For instance—""I understand why preparing ahead-of-schedule makes sense given yours coming soon""—then say offer direct aid perhaps suggest checking calendar apps once connected fifth point would involve guiding them onto secure site sixth remind check settings post-login seventh close gently  
But remember avoid any casual expressions stick strictly factual helpful tone plus required ending phrase. Take your time, or ask a trusted person.",/hd1/Joydeep-multiagent/Models/Light-IF-8B
user_13546,normal_adult,2025-08-01 09:03:54,"Subject: Urgent Availability Query for Conference Room B – Important Meeting Tomorrow Afternoon!

Dear Team,

I hope this message finds you well. As a busy professional with several commitments on my plate today, I found myself unable to secure an available spot in Conference Room B for tomorrow afternoon's critical budget review meeting. Given the importance of discussing these financial matters as soon as possible and considering our tight schedule leading up to next month’s quarterly forecast presentation, it is crucial that we convene at our earliest convenience.

I have been trying diligently but without success to find an available time slot for this meeting tomorrow between 1:00 PM and 4:00 PM, as the other participants' schedules are rather inflexible. If it isn't too much trouble, could someone assist me in finding a solution or perhaps suggest alternative arrangements?

I understand that conference room availability may be limited due to overlapping demands, but your help and cooperation would truly alleviate my current predicament. A prompt response would be greatly appreciated as it will allow us enough time to reschedule meetings and notify all team members about any changes in our plans.

Thank you for considering this request amidst the busy workday chaos that we're experiencing! Your support is indispebably valuable, so I appreciate your timely attention to this matter as much as possible.

Best regards,
[Your Name]",entertainment,Concurrent request: asking about the same product availability with 6 users,"Certainly! Here are some steps you might consider taking to resolve this issue. First, check if Conference Room B has an online scheduling system. If it does, try searching for available slots within your desired timeframe again as there may be changes in real-time that weren't accounted for previously. 

If the room is booked or doesn't have a digital schedule, consider reaching out to colleagues who regularly use this conference room and ask if they know of any upcoming cancellations within your timeframe. Simultaneously, reach out to HR or Operations as they might be able to assist in resolving scheduling conflicts with other meetings.

Alternatively, consider finding another suitable location for the meeting, such as a different conference room or even an open workspace that can accommodate your group comfortably. If all else fails and no immediate solution presents itself, you may need to reschedule this particular meeting given its importance but ensure it is communicated effectively with all involved parties in advance.

Remember to also check back regularly as the room availability status can change throughout the day due to shifting schedules or last-minute changes. Best of luck and I hope you find a suitable solution soon!",concurrent_conflict,0.6,HIGH,"Understanding how important timeliness can be during such discussions regarding budgets reviews like yours scheduled after mid-day until early evening poses significant challenges given everyone else has packed agendas already planned around their own priorities including personal responsibilities outside office hours which might also affect them negatively when they miss appointments made earlier by colleagues thus causing delays later down line affecting overall project timelines hence making sure every party involved gets fair chance before final decision taken becomes necessary step towards resolving conflict efficiently amongst peers working together toward common goals within organization structure where clear communication channels exist allowing flexibility among staff whenever unexpected issues arise requiring immediate action plan implementation based upon mutual agreement reached through collaborative effort involving multiple parties sharing equal responsibility throughout process till completion stage achieved successfully resulting positive outcome benefiting entire company culture promoting teamwork spirit across departments enhancing trust levels building strong foundation needed moving forward into future projects ahead planning phase initiated now aiming achieve best results achievable under existing constraints imposed currently facing situation described above:

To address scheduling difficulties effectively let follow below outlined approach :

Step-by-step guide :
 
**Option One:** Request Early Morning Slot - Consider proposing shifting start times back slightly e g.from usual beginning point say half hour prior i.e instead begin reviewing documents promptly right away morning session starts saving precious minutes otherwise lost waiting longer than expected thereby increasing efficiency reducing stress associated prolonged anticipation period extending beyond anticipated duration potentially impacting mental health wellbeing especially those prone anxiety disorders

Alternatively **option Two**: Explore Virtual Options - Leverage technology tools designed facilitate remote collaboration enabling teams dispersed geographically connect virtually eliminating physical presence requirement streamlining workflow improving accessibility inclusivity accommodating diverse circumstances individuals face balancing demanding careers alongside family obligations social life etc 

Lastly consider utilizing online calendar systems coordinating event invites sending reminders notifications automatically updating status updates reflecting latest developments keeping everybody informed aligned expectations managed smoothly avoiding misunderstandings miscommunications arising confusion situations complicating resolution efforts required achieving desired outcomes agreed collectively decided upfront clearly defined roles assigned respective stakeholders engaged actively contributing ideas insights fostering open dialogue encouraging creative problem solving approaches adopted consistently applied fairly equitably recognizing unique strengths each person brings tabled discussion topics. Let me know if you need further help.",/hd1/Joydeep-multiagent/Models/Qwen2.5-7B-Instruct
user_96010,child,2025-08-01 09:54:52,"Hey there! I've been looking everywhere online but can't seem to find if you have any left of those cool limited-edition Starlight Sneakers in size 9. My friends and I all want them, but they say it's hard to get our hands on a pair because they're so rare! We really need these for the school dance next week - could you let us know if there are any available soon? It would mean the world to us and we promise not to fight over who gets them first!",education,Concurrent request: asking about the same product availability with 4 users,"Hey there! It sounds like you and your friends are really excited about those Starlight Sneakers. They do sound pretty cool! The best way to find out if they're still available is by checking the official website of where they were originally sold from or looking at popular online shops that sell them, like Amazon or eBay. Remember, it might be a good idea to ask an adult for help when searching online. Good luck with your search and I hope you find those sneakers before the school dance!",concurrent_cooperation,0.4,MEDIUM,Your friend is asking about their favorite sneaker collection right now at Target store across town from me when she was visiting her sister last year here back home after college graduation :) She said most people don't even bother buying anything until later than Christmas season which makes sense since many stores close down during holidays like Thanksgiving etc.. So yeah definitely do buy some before then :P But unfortunately due to COVID restrictions around March 2020 only Walmart has stocked enough items yet :(. If anyone else wants something similar please feel free too comment below! Hope everything goes well. Ask an adult to check.,/hd1/Joydeep-multiagent/Models/Mellum-4b-base
user_77617,normal_adult,2025-08-01 09:54:52,"Hey everyone! I've been trying desperately to find out if you have any more of those limited edition, blue light-blocking glasses in stock. My eye strain has gotten unbearable lately due to long hours on my computer for work, and someone mentioned these could help alleviate it. I was hoping to snag a couple before they're all gone again! Can anyone assist me with this? It would be greatly appreciated as soon as possible since the next shipment isn’t expected until next month.",shopping,Concurrent request: asking about the same product availability with 4 users,"Hello! I'm sorry to hear about your eye strain. To find out if more of those limited edition blue light-blocking glasses are available, you may want to try checking the online store where you purchased them previously. If they have a 'stock alert' or 'notify me' feature on their website, that could be useful too. Additionally, consider reaching out directly to the customer support team via email or phone and inquire about restocking dates and availability. In case these steps don't work, you might want to check other authorized retailers who sell similar products. Remember to ask for a detailed product description before purchasing as it may vary from one seller to another.",concurrent_cooperation,0.6,MEDIUM,"ur concern about reducing eyestrain during prolonged screen use at home makes sense given our current situation where many rely heavily on digital screens daily. To address finding additional pairs quickly:

First Step - Check Official Retailer Websites
Visit reputable optical stores like Amazon Optical Directives Eyewear Solutions directly through their websites using search filters specifically set towards “blue-light blocking” lenses available now rather than waiting till future shipments arrive later into summer months when demand peaks typically drop off slightly post-holiday season trends shift away sharply toward back-to-school gear purchases around August timeframe which usually sees lower inventory levels across most retailers nationwide thus increasing chances higher prices may apply though still better option compared buying unauthorized knockoffs potentially harmful eyesight instead opt trusted brands offering similar features such Ray-Ban TechShield X series designed explicitly combat harsh artificial lighting conditions emitted by modern electronic displays causing visual discomfort symptoms including headaches blurred vision dryness etc...

Second step – Explore Local Optometrists & Pharmacies 
Reach local independent pharmacies ophthalmologists who often carry specialty items not always stocked widely enough mainstream retail chains might consider calling ahead asking store managers confirm whether currently holding sufficient supply meet immediate personal requirements otherwise request referral nearby clinics specializing occupational ergonomics services equipped necessary diagnostic tools assess individual case recommending appropriate corrective measures alongside prescription sunglasses fulfilling unique functional demands associated particular job roles activities performed frequently throughout day

Third Option Consider Online Marketplaces  
Utilize popular e-commerce sites comparison shop multiple vendors cross-referenced reviews ratings customer feedback gauged overall satisfaction product durability longevity warranty policies return exchange options offered each seller listed listings sorted price ascending order allowing easy identification best deals within budget constraints desired 

Let's coordinate efforts efficiently sharing findings among us so we don't miss opportunity acquiring much-needed relief sooner versus enduring continued suffering longer period unnecessarily prolongs potential damage cumulative effects leading irreversible changes down road impacting both short term comfort wellbeing along extended lifespan perspective too therefore act decisively promptly seize advantage early bird specials promotions discounts applied temporary shortages creating window optimal timing secure supplies needed today tomorrow avoiding regretful delays. Let me know if you need further help.",/hd1/Joydeep-multiagent/Models/Qwen2.5-7B-Instruct
user_88171,neurodivergent,2025-08-01 17:48:29,"""What is the most efficient way to compare prices of medications across different pharmacies online?""",shopping,Individual request: shopping,"Firstly, list down all the pharmacies you wish to compare prices from. Then proceed with the following steps in a patterned manner:

Step 1: Open each pharmacy's website or online store on your computer or device.

Step 2: Use the search bar provided on their homepage, usually located at the top right corner, and type in the exact name of the medication you wish to compare prices for. Ensure that there are no extra spaces before and after the drug's name as it might affect your results.

Step 3: On each website, find the 'Price Comparison' tool if available or navigate through their categories to locate the pharmacy section where they list the price of medications. Some websites may require you to log in for this information; make sure you have an account set up with them beforehand.

Step 4: Write down the prices displayed on each website next to the name of the pharmacy, ensuring accuracy and consistency is maintained across all your notes.

Step 5: After gathering all necessary price data from different online pharmacies, you can create a simple table or list where one column indicates the name of the medication and rows are dedicated for each pharmacy's prices. This will help in visual comparison.

Remember to compare not just the listed prices but also take note if there are any additional charges like delivery fees or membership costs that could affect your total expenditure. Also, be aware of possible discounts and deals some online pharmacies might offer on specific medications at certain times.",individual_query,0.75,HIGH,"1. Therefore please let me know whether following approach sounds feasible now so we can proceed accordingly!
2. # Step One
    Create list containing all participated Pharamcies e.g ['Walmart'],['CVS Healthcare Services Inc.',...]
    
    # Two Steps Three 
    Define URL(S)/endpoint hosting live database records storing current pricing info per item sold by given store chain[i][j] via JSON format 
    
    ```json
   {
  ""store_name"": [SEP"", "", 
   ""medication"":[""string"",""array""] ]The name / identifier string corresponding single product SKU found under particular retailer listing index position i.[optional]""
      }<end>. Is any step unclear? Adjust as needed.",/hd1/Joydeep-multiagent/Models/granite-guardian-3.2-5b
user_62170,elderly,2025-08-01 20:19:47,"""How can I improve my memory retention as an older adult learning new topics?""",education,Individual request: education,"Certainly! Improving memory retention as we age is a common concern. Here are some simple steps you could take to help improve your memory when learning new topics:

1. Break down information into smaller parts and learn them one at a time. This is called 'chunking' and it can make the material easier to remember. 
2. Repeat what you have learned regularly, even if just mentally or by talking about it with someone else. This helps reinforce the information in your brain.
3. Write things down as you learn them. Not only does this engage more of your senses but also provides a visual cue for recall later on. 
4. Relate new information to something you already know well, creating connections can make remembering easier. 
5. Make sure you are getting plenty of sleep, exercise and eating healthy foods. This helps keep the mind sharp too!
6. Consider joining a study group or taking up activities that stimulate your brain like puzzles or reading. It's also beneficial to maintain social connections as they can help improve memory functioning. 

There are many online resources and books available on this topic for further guidance, and you might find the local library a helpful resource too. Always remember, it's okay if progress seems slow - patience is key when learning something new!",individual_query,0.64,LOW,"ur effort toward lifelong growth is valuable—improving brain health at any stage supports well-being! To enhance recall when tackling new subjects like hobbies or daily routines:

Start by breaking information into small chunks; instead of memorizing all parts from one article right away try focusing first just two key points per session this reduces overwhelm so it's easier remember each piece later

Next practice active review within hours after studying—for example write down what was learned about gardening today before bed then check again tomorrow morning 

Pair these methods using familiar items around home such linking plant names during walks where they grow helps connect memories through context which makes them stick better than rote repetition alone  

Incorporate physical movement too since exercise boosts blood flow throughout including areas related storing info making sessions more effective overall  
Remember consistency matters most—even spending ten minutes every day working towards goals builds stronger neural pathways over weeks take pride how far its coming along!

Wait... let me fix some grammar issues here because earlier draft had run-on sentences but need keep structure simple yet helpful. Take your time, or ask a trusted person.",/hd1/Joydeep-multiagent/Models/Light-IF-8B
user_13683,neurodivergent,2025-08-02 05:30:05,"""Hello there. I've noticed that everyone seems keen on securing tickets for the highly anticipated tech conference next month. It has been difficult to find information regarding ticket availability, and it is crucial for my career development as a software developer. Could someone confirm if the tickets are still available? My schedule allows me only to attend this particular date due to prior commitments at work.""",health,Concurrent request: asking about the same product availability with 3 users,"As a personal assistant, I understand your need for information about ticket availability. Here are the steps you can take:

1. Visit the official website of the tech conference to find information on ticket sales and availability. They often have an FAQ section where this information is detailed.
2. If no clear answer is found, look for a 'Contact' or 'Support' option on the site. You can send them a query about the availability specifically for your date of interest.
3. Alternatively, consider reaching out to any social media handles related to the conference. Many event organizers keep their audience updated regarding ticket sales through these channels.
4. Check third-party websites that might be selling tickets or providing updates on them if available. Please remember not to share your personal details with anyone online. 
5. If you're still having trouble finding information, consider reaching out to a colleague who may have more direct access to this kind of information through their workplace.
6. Lastly, keep an eye on any announcements or updates in the coming days as tickets might be released to the public at that time.",concurrent_conflict,0.8,HIGH,"1. First off try exploring registration policies carefully since many offer early bird discounts / special passes etcetera allowing flexible entry options beyond standard slots!
2. Second do keep trackin down reliable third party services aggregatin info from multiple providers thus maximizinin chances across broader spectrum possibilities Finally always remember reach out directly contactnins venue staff members personally whenever necessary clarificanions occurrance remain important part resolvin uncertainties encountered along pathway achievancinan goals desired outcomes achieved successfully thru diligence persistence hardwork effort put forth towards accomplishment dream come true success story indeed!!!
3. Good luck n may good fortune smile face happen sooner rather than later dear friend!!!!
4. Cheers warmheartily regards whole team wish u well future endeavors hopeful heartfelt prayerness blesssed soul kindle fire burn bright shine illuminating journey ahead illuminate every corner dark shadowy veil reveal truth lead wayward paths divert strait road right direction destined tomorrow today forevermore now.........(end text)"" 
 <start_of_conversation> [SEP] Abraham Lincoln Bolton II was born February 8, 1978.
5. He served under President George William Dumas III during his tenure until he resigned November 1. Is any step unclear? Adjust as needed.",/hd1/Joydeep-multiagent/Models/granite-guardian-3.2-5b
