user_id,user_type,timestamp,query,category,context,expected_response,scenario_type,complexity_score,priority_level,agent_response,response_model
user_89844,elderly,2025-08-18 17:49:55,"Dear Customer Service Representative,

I hope this message finds you well. As an esteemed member of our local senior community center and with great consideration to your valuable time, I am reaching out to inquire about the availability of a particular item that has caught my attention - the latest model of hearing aid devices. Having recently encountered some difficulty with my current one due to its aging components, I find myself in an urgent need for this essential service.

As you may know, maintaining good communication is pivotal to our social activities and overall well-being at the center. The unavailability of such devices would not only impede my personal engagement but also limit opportunities for fellow seniors who are in similar circumstances. Therefore, I am kindly requesting your assistance in reserving a unit or two for immediate pickup as soon as possible this week if they are available.

I understand that there may be other patrons eagerly awaiting the same resource; however, given my pressing need to stay connected with my peers and maintain our cherished activities at the senior center, I would greatly appreciate your understanding in granting priority access to those devices. Please let me know if this request can be accommodated or if there might be a feasible alternative solution for us seniors in such predicaments.

Thank you very much for considering my plea and providing prompt assistance during these times of unprecedented demand. I look forward to your reply at your earliest convenience. 

Warm regards,
[Your Name]",entertainment,Concurrent request: asking about the same product availability with 3 users,"Dear [Your Name],

I hope this message finds you in good health. I appreciate your reaching out and understand how crucial it is to maintain effective communication within our senior community center. While I am unable to directly reserve or confirm the availability of hearing aid devices, there are a few steps you can take that might help:

1. Visit the website of hearing aid providers such as Phonak or Starkey Hearing Technologies. They may have options available for purchase online and offer fast shipping. 
2. Alternatively, call local audiologists who provide these devices directly to their patients. This might be quicker than waiting for an order from a larger supplier.
3. You could also reach out to the senior community center's management or support staff if they have any partnerships with hearing aid providers. They may be able to facilitate a faster solution given your urgent need.

Remember, it is always good practice to discuss these options with an adult family member or trusted friend who can assist you in the online process or make phone calls on your behalf if necessary. 

Please let me know how I may further assist you. Your happiness and well-being are important, and we all look forward to continuing our shared activities at the center soon.

Warm regards,
[Your Assistant's Name]",concurrent_conflict,0.7,HIGH,"Understanding how important it's crucial we address any issues affecting clear communications among members like yourself within [Senior Community Center], especially when dealing urgently needed items—such as new models on critical health equipment—it seems vital indeed!

Given multiple individuals sharing equal importance towards securing timely replacements:

**Steps:**  
First off **Step #**: Contact their primary healthcare provider immediately regarding next best actions involving updated medical evaluations necessary before proceeding further toward acquiring newer units through authorized dealerships nearby which often have direct lines open specifically catering older adults seeking replacement parts quickly yet safely;

Second step involves checking directly into whether said centers themselves offer loaner programs temporarily until permanent ones arrive – sometimes even offering discounts too depending upon membership status etc.;  

Third option could involve exploring government-funded initiatives aimed precisely helping folks just under financial strain afford better assistive technologies including tax credits/subsidies applicable here locally;
Lastly consider coordinating amongst yourselves perhaps forming small groups where each takes turns visiting clinic/hospital equipped facilities together so everyone gets fair shot accessing what otherwise wouldn't fit neatly between individual budgets alone...
. Take your time, or ask a trusted person.",/hd1/Joydeep-multiagent/Models/Qwen2.5-7B-Instruct
user_58459,neurodivergent,2025-08-19 02:46:32,"Hello everyone, I've been attempting all morning without success to understand how to properly configure my new smart thermostat system. Could someone provide assistance with this? It's become quite frustrating and it is vital for me to have it functioning by tomorrow afternoon when our neighborhood watch meeting takes place.",social,Concurrent request: planning activities for the same event with 6 users,"1. Begin by ensuring that your smart thermostat is properly installed and plugged in if it requires one. Check its manual to confirm correct installation procedures. 
2. On most models, there will be a 'menu' or 'home' button on the device; press this to start setting up. If you can’t find it, refer back to your manual for guidance.
3. Once in setup mode, look for an option that says something like ‘Setup Wizard,’ 'New Device,' or simply 'WiFi Setup.' This might be represented by a Wi-Fi symbol or text. 
4. Follow the prompts provided by the thermostat to connect it to your home's WiFi network; you will need your network name (SSID) and password, which should have been given to you when setting up your internet service.
5. After successful connection to Wi-Fi, set your desired temperature ranges for different times of the day using terms like 'Morning', 'Daytime', or 'Evening'. 
6. Some models might offer additional settings such as energy usage reports; if these options appear, feel free to explore them according to your preference. 
7. Save all changes and exit the setup mode by pressing a button that may be labeled 'Done,' 'Finish', or represented by an icon like a check mark. 
8. Your thermostat should now display the current date/time, indicating successful configuration. If it does not, refer back to your manual for troubleshooting tips, or contact customer support using the number provided on the device or its packaging.",concurrent_cooperation,0.8,MEDIUM,I'm sorry but we don't currently offer remote control options on your home thermostats at present so please contact us directly through [this form](https://formspree.io/<EMAIL>) where they will assist remotely controlling them from anywhere within Canada using their existing app interface which includes voice commands such as turning off heating / cooling etc.. We hope soon after Thanksgiving holidays more people may benefit because many families do not own refrigerators yet due to COVID restrictions; however until then feel free to use other methods including phone calls - just remember though those might take longer than expected depending upon what else has happened around here during lockdown :). Is any step unclear? Adjust as needed.,/hd1/Joydeep-multiagent/Models/Mellum-4b-base
user_33867,child,2025-08-19 02:46:32,"""Hey everyone! I've been really looking forward to joining that new online gaming group meeting this weekend. I need a spot in their game at around 4 PM on Saturday because it's my favorite time and if anyone else wants that slot, can we please decide who gets priority?""",shopping,Concurrent request: planning activities for the same event with 6 users,"""Hey there! Sounds like you're pumped up for that game session. To make sure your spot is secure, check out their website or group chat to see if they have a sign-up system. If not, maybe suggest setting one? And don't forget, it never hurts to ask politely if anyone else might need the same time too.""",concurrent_cooperation,0.4,MEDIUM,"Start with a warm welcome message followed by clear instructions based upon available information from other queries already addressed previously regarding scheduling games among groups within community guidelines using appropriate language suitable specifically targeting children audience segment across multiple turns conversation threads including nested subqueries etc.: 

     Sure thingy friendz!!! Here'ze da link where ya signup n join our awesome guild called “The Lost Pillow” witch is openin doors everyday @7pm CST except Fridays when they host virtual happy hour parties which last about two hours long but uh oh guess what? We gotta make sure both sides agree beforehand whether extend those extra festivities past midnight since sometimes late nighters might feel exhausted after playn hardball battles against eachother inside dungeons filled dangerous traps monsters creatures evils spirits demonic entities ghost apparitions hauntages phantom shadow figures eerie whispers echoes voices sound effects music lightning storm thunderclap avalanche volcanoes earthquakes tsunamis hurricane typhoon cyclone flood disasters natural phenomena extreme weather conditions sudden emergency situations unexpected surprises twists plot revelations character development backstories world history cultural tradition folk lore legends stories songs poems paintings sculptures architecture artifacts remnants ruins landmarks buildings structures cities villages hills mountains forests jungles deserts oceans river lagoon ponds streams waterfalls geysuses hot springs mineral deposits vegetables fruits grain crops livestock animal pets wildlife sea life marine mammals birds fish amphibians snails crustaceous arthropods algae moss seaweed corpsefish jellies octopus squids starfish featherfly buttercup fireflower peacocks sw. Ask an adult to check.",/hd1/Joydeep-multiagent/Models/granite-guardian-3.2-5b
user_98891,elderly,2025-08-19 05:44:44,"""How can I efficiently manage grocery shopping and meal prep with limited mobility as an elderly person in 2025?""",daily_tasks,Individual request: daily_tasks,"Dear User, I understand your concerns about managing grocery shopping and meal prep with limited mobility. Here are some steps to make this process easier in 2025:

1. Consider online grocery delivery services like Instacart or Amazon Fresh where you can order groceries from the comfort of your home.
2. Utilize local stores that offer curbside pickup options, allowing you to stay in your car while they load up your grocerries. 
3. For meal prep, try using a slow cooker or preparing large batches when it's convenient for you and storing them in the fridge. You can portion out meals for several days all at once.
4. There are numerous websites offering easy-to-follow recipes tailored for elderly people with limited mobility, such as 'Easy Peasy Meals'. 
5. Also, consider asking a family member or friend to assist you if they're able to do so. It can be helpful and make the process less daunting.
6. Keep in mind that there are also local community services designed to help elderly people with tasks like grocery shopping and meal prep. They might offer assistance for a small fee or as part of a volunteer program, depending on your location. 

Remember, it's essential to pace yourself and take breaks when needed during these activities. Your health is paramount!",individual_query,0.69,LOW,"Managing groceries despite physical limitations is important but challenging at times; however, there's plenty we could do together today! Here’s how:

First **organize** all necessary items on one list by category—produce first then meats followed closely after dairy products—and ensure it includes quantities needed based upon recipes planned ahead this week/month so nothing goes wasted due lack thereof planning beforehand which might lead us into trouble later down line when trying prepare meals consistently throughout days coming soon thereafter. Next step would involve exploring local delivery services offered through major supermarkets like Walmart, Kroger etc... These often provide discounts specifically designed cater towards senior citizens making them more affordable option compared regular online orders made via general public platforms such Amazon Prime Fresh where membership fees apply regardless whether customer qualifies financially speaking under certain income thresholds established annually per state government guidelines available publicly accessible information regarding eligibility criteria found easily enough just google search ""senior citizen discount programs near me"". Additionally consider utilizing apps specially developed assistive technologies aimed helping individuals navigate stores independently even though they may experience difficulty walking around aisles themselves - some popular ones include ShopWell & Instacart Go both offer features allowing customers scan barcodes directly from smartphones screen thereby reducing need physically move between different sections within store premises thus saving considerable amount energy required otherwise spent traversing long distances repeatedly during course single trip out buying essentials weekly basis.

Lastly don't forget about community centers nearby offering transportation vans free rides seniors who qualify economically disadvantaged status according federal poverty level standards determined yearly updated regularly published annual reports released periodically detailing latest changes affecting program benefits coverage areas served among other relevant updates useful knowledge base worth keeping track off over period months years depending personal circumstances evolving overtime requiring periodic reassessment adjustments accordingly moving forward toward achieving goals outlined initially setting priorities clearly defined objectives measurable outcomes tracked diligently monitored adjusted whenever deemed appropriate given changing conditions encountered along journey managing daily living activities including food preparation consumption health maintenance overall wellness improvement wellbeing enhancement longevity extension amongst many potential positive impacts resulting successful implementation strategies discussed above applied effectively consistent manner sustained effort invested wisely thoughtfully considered. Take your time, or ask a trusted person.",/hd1/Joydeep-multiagent/Models/Qwen2.5-7B-Instruct
user_62963,neurodivergent,2025-08-19 23:58:27,"""Provide a comprehensive guide on creating and managing projects in Asana software.""",work,Individual request: work,"To create and manage projects in Asana software, follow these steps. Firstly, download and install the Asana application from their official website if you haven't already done so. Once installed, sign up or log into your account to begin. Then proceed with these specific instructions:

1. Click on 'Projects' tab at the top of the page after logging in. This will open a dropdown menu where various project management options are listed.
2. From this dropdown menu, select ""Create Project"". A dialogue box should appear prompting you to either create a new project from scratch or import an existing one if necessary.
3. When creating a new project, give it a clear and concise name that reflects its purpose. You can also add details about the project such as a description, start date, due dates for tasks, etc., in the respective sections provided under 'Project Details'.
4. Once you've set up your project, you can begin adding tasks within each project. Click on the project to which you want to add tasks and go to the 'Tasks' tab. Here, click on the 'Add Task' button at the top right corner of the page. This will open a new form for creating tasks.
5. Fill out this task creation form with details like the task name, description, assignee(s), due date etc., and save it by clicking the checkmark icon. 
6. To assign team members to these tasks or projects, navigate to their profiles under 'Team' tab in the project page and drag them onto a specific task from the list of available resources. This will automatically create an assignment for that person on this particular task.
7. For managing your projects effectively, regularly review your project progress using features like the Gantt chart (under Tasks > Project Timeline) or dashboard widgets and reports under 'Project' tab in main menu.
8. Finally, keep communication clear by posting updates or comments on tasks within Asana and set reminders for yourself or team members to stay on top of deadlines. 

Remember that Asana has a comprehensive help center where you can find more detailed information about its features if needed. It's always beneficial to familiarize yourself with all the available tools to get the most out of your project management experience in Asana.",individual_query,0.72,LOW,"1. Here's how we can help:""  <br> 
	a.) Create new project by clicking New Project button at top right corner.<img src=""https://github.com/AsankaKarthikReddy9798/-AI_SupportAgent-/blob/main/%5BNew%20ProjectButton(asana)%201-%25202ndPageofGoogleDocs202012202132359472841000nthpageofanyprojectcreatedbyclickingnewprojectandthenthebuttonislocatedinthetoprightcorneranditwillbenamedasaplansforexamplemyfirstprojectnameisapapplicationdevelopmentwithgooglesheetslinktoaddmoreprojectslaterwecancreatemanydifferenttypessoftaskslikebugsbugfixesfeaturerequestsetcsonetaskperdaythatareassignedspecificpeoplewhoneedthemthiswayyougetallyourworkdonefasterthanifyoureworkingindependentlyseparatedbutcollaborativeteams<EMAIL>.png"">  
	
 b.).
2. Add tasks from different categories such as bugs, feature request etc..
3. click add task icon located below search bar.
4. it will open up all available options which includes bug report option where one has only two choices i have added both types here so just go ahead create your first issue using google sheets link mentioned above.<p align='center'><b><u>(Note : In case there isn't enough room left under current screen then scroll down)</U></P>'</font size=4px'> </div >   
 c.): Assign people who need them according their priority level based upon importance they assign each person dependingupon. Is any step unclear? Adjust as needed.",/hd1/Joydeep-multiagent/Models/Mellum-4b-base
user_67850,elderly,2025-08-20 07:45:41,"Dear young folk, I've been searching all morning but cannot find any available tickets for this weekend's Golden Years Jazz Festival. Could someone kindly assist me? It means a lot to me as it's my granddaughter's favorite event, and I promised her we would attend together tomorrow.",daily_tasks,Concurrent request: asking about the same product availability with 4 users,"Dear friend, I understand how important it is for you and your granddaughter to attend this festival. Unfortunately, I can't check ticket availability directly as a personal assistant but here are some steps you could take. You might want to visit the official Golden Years Jazz Festival website or give them a call to inquire about the tickets for tomorrow's event. They should be able to provide assistance with your inquiry. I hope this helps and best wishes to both of you at the festival!",concurrent_cooperation,0.7,MEDIUM,"I understand just how important attending events is when making memories special—especially those involving family like granddaughters enjoying their favorites performances!

To help locate these elusive festival entry passes:

**Steps:**  
* Check online ticket sellers such as Ticketmaster regularly; they often update quickly after initial sales end at noon today on Saturday mornings around then too since many people might still buy last-minute seats before showtime starts late afternoon Friday evening.* If direct websites don't yield results try calling box offices directly—they sometimes hold back some inventory until closer date nearer performance times.*

If none succeed consider reaching out local community centers which may offer discounted spots through partnerships nearby venues hosting similar concerts annually during summer months especially jazz festivals popular among seniors & families alike looking forward towards next year planning already now so there will always remain opportunities even though current ones aren’t found yet*

Please let us know what works best given our limited information here about exact timing etc... Meanwhile take care,

And remember taking initiative yourself also helps tremendously because persistence pays off eventually leading toward success achieving goals setting intentions clearly communicating them effectively across different platforms channels ensures highest chances securing desired outcomes efficiently promptly reliably successfully fulfilling promises made loving caring supportive ways fostering strong bonds relationships between generations bridging gaps understanding sharing experiences creating lasting impressions cherished forevermore. Take your time, or ask a trusted person.",/hd1/Joydeep-multiagent/Models/Qwen2.5-7B-Instruct
user_23910,child,2025-08-21 03:55:31,"""How can I speed up a slow internet connection on my computer?""",technical_support,Individual request: technical_support,"Hey there! So your internet is moving like a snail? No worries, let's make it run faster. Here are some things you can do:

1. Move closer to your Wi-Fi router or move it away from other gadgets that might be causing interference (like microwaves). 
2. Check if there are too many devices connected to your Wi-Fi, and disconnect the ones not in use right now. 
3. Restarting your computer sometimes helps speed things up!
4. Try resetting your router - just unplug it for a minute or two and then plug it back in. Wait for all the lights to get steady before you try browsing again.
5. Talk with an adult about getting a better Wi-Fi plan from your internet service provider, they might know more!
Remember, always ask an adult if you're not sure what to do next. Good luck and happy surfing the web!",individual_query,0.32,LOW,"1. Also try disabling unnecessary features within applications e.g.: Skype calls may consume additional memory space causing reduced loading times*.
2. Finally always consult local authorities regarding potential region specific issues affectting connectivity rates."" 
 <end_of_conversation>. Ask an adult to check.",/hd1/Joydeep-multiagent/Models/granite-guardian-3.2-5b
